[
  {
    "id": 1,
    "title": "Introduction to Artificial Intelligence",
    "code": "CS 188",
    "department": "Electrical Engineering & Computer Sciences",
    "instructor": "Prof. Stuart Russell",
    "building": "Dwinelle Hall",
    "room": "155",
    "lat": 37.8724,
    "lng": -122.263,
    "walkingMinutes": 3,
    "startTime": "08:00",
    "endTime": "09:00",
    "interests": [
      "Tech",
      "Science"
    ],
    "description": "Introduction to the basic ideas and techniques underlying the design of intelligent computer systems. Topics include search, game playing, knowledge representation, inference, planning, decision making under uncertainty, and machine learning.",
    "meetDays": "MW"
  },
  {
    "id": 2,
    "title": "Data Structures",
    "code": "CS 61B",
    "department": "Electrical Engineering & Computer Sciences",
    "instructor": "Prof. Josh Hug",
    "building": "Wheeler Hall",
    "room": "150",
    "lat": 37.8731,
    "lng": -122.2598,
    "walkingMinutes": 2,
    "startTime": "09:00",
    "endTime": "10:00",
    "interests": [
      "Tech"
    ],
    "description": "Fundamental dynamic data structures, including linear lists, queues, trees, and other linked structures; arrays, strings, and hash tables. Storage management. Elementary principles of software engineering.",
    "meetDays": "MWF"
  },
  {
    "id": 3,
    "title": "Machine Learning",
    "code": "CS 189",
    "department": "Electrical Engineering & Computer Sciences",
    "instructor": "Prof. Jitendra Malik",
    "building": "Soda Hall",
    "room": "306",
    "lat": 37.8757,
    "lng": -122.2596,
    "walkingMinutes": 5,
    "startTime": "11:00",
    "endTime": "12:00",
    "interests": [
      "Tech",
      "Science"
    ],
    "description": "Theoretical foundations and practical methods for machine learning and pattern recognition. Supervised and unsupervised learning, neural networks, deep learning, generative models.",
    "meetDays": "TTr"
  },
  {
    "id": 4,
    "title": "Calculus II",
    "code": "MATH 1B",
    "department": "Mathematics",
    "instructor": "Prof. Edward Frenkel",
    "building": "Evans Hall",
    "room": "70",
    "lat": 37.8733,
    "lng": -122.2582,
    "walkingMinutes": 4,
    "startTime": "08:00",
    "endTime": "09:00",
    "interests": [
      "Science"
    ],
    "description": "Techniques of integration; applications of integration. Infinite sequences and series. First-order ordinary differential equations. Second-order ordinary differential equations; oscillation and damping.",
    "meetDays": "MTr"
  },
  {
    "id": 5,
    "title": "Linear Algebra and Differential Equations",
    "code": "MATH 54",
    "department": "Mathematics",
    "instructor": "Prof. Olga Holtz",
    "building": "Dwinelle Hall",
    "room": "155",
    "lat": 37.8724,
    "lng": -122.263,
    "walkingMinutes": 3,
    "startTime": "10:00",
    "endTime": "11:00",
    "interests": [
      "Science"
    ],
    "description": "Basic linear algebra; matrix arithmetic and determinants. Vector spaces; inner product spaces. Eigenvalues and eigenvectors; linear transformations. Homogeneous ordinary differential equations.",
    "meetDays": "WF"
  },
  {
    "id": 6,
    "title": "Introduction to Philosophy of Mind",
    "code": "PHIL 132",
    "department": "Philosophy",
    "instructor": "Prof. John Searle",
    "building": "Moses Hall",
    "room": "223",
    "lat": 37.8737,
    "lng": -122.261,
    "walkingMinutes": 4,
    "startTime": "14:00",
    "endTime": "15:00",
    "interests": [
      "Philosophy"
    ],
    "description": "An examination of the mind-body problem, consciousness, intentionality, and personal identity. Topics include dualism, physicalism, functionalism, and the nature of mental causation.",
    "meetDays": "MTW"
  },
  {
    "id": 7,
    "title": "Ethics and Society",
    "code": "PHIL 2",
    "department": "Philosophy",
    "instructor": "Prof. Niko Kolodny",
    "building": "Dwinelle Hall",
    "room": "182",
    "lat": 37.8724,
    "lng": -122.263,
    "walkingMinutes": 3,
    "startTime": "09:30",
    "endTime": "11:00",
    "interests": [
      "Philosophy"
    ],
    "description": "An introduction to the major ethical theories and their application to contemporary moral problems. Topics include consequentialism, deontology, virtue ethics, and applied ethics.",
    "meetDays": "MWTr"
  },
  {
    "id": 8,
    "title": "Introduction to World History",
    "code": "HIST 1",
    "department": "History",
    "instructor": "Prof. Robin Einhorn",
    "building": "Wheeler Hall",
    "room": "204",
    "lat": 37.8731,
    "lng": -122.2598,
    "walkingMinutes": 2,
    "startTime": "11:00",
    "endTime": "12:00",
    "interests": [
      "History"
    ],
    "description": "A survey of world history from prehistoric times to the present. Emphasis on comparative analysis of major civilizations and the dynamics of historical change.",
    "meetDays": "M"
  },
  {
    "id": 9,
    "title": "The History of the United States",
    "code": "HIST 7B",
    "department": "History",
    "instructor": "Prof. Leon Litwack",
    "building": "Dwinelle Hall",
    "room": "182",
    "lat": 37.8724,
    "lng": -122.263,
    "walkingMinutes": 3,
    "startTime": "13:00",
    "endTime": "14:00",
    "interests": [
      "History"
    ],
    "description": "The history of the United States from Reconstruction to the present, including industrialization, immigration, labor movements, civil rights, and the rise of global power.",
    "meetDays": "T"
  },
  {
    "id": 10,
    "title": "Introduction to Biology",
    "code": "BIO 1A",
    "department": "Molecular & Cell Biology",
    "instructor": "Prof. David Bilder",
    "building": "Valley Life Sciences",
    "room": "2050",
    "lat": 37.8751,
    "lng": -122.262,
    "walkingMinutes": 5,
    "startTime": "08:00",
    "endTime": "09:00",
    "interests": [
      "Science"
    ],
    "description": "General introduction to cell biology, genetics, molecular biology, physiology, and evolution. Lab sections provide hands-on experience with biological techniques.",
    "meetDays": "W"
  },
  {
    "id": 11,
    "title": "Human Anatomy",
    "code": "INTEGBI 131",
    "department": "Integrative Biology",
    "instructor": "Prof. Leslea Hlusko",
    "building": "Valley Life Sciences",
    "room": "1101",
    "lat": 37.8751,
    "lng": -122.262,
    "walkingMinutes": 5,
    "startTime": "10:00",
    "endTime": "11:00",
    "interests": [
      "Science"
    ],
    "description": "Systematic study of the structure of the human body. Regional and systemic approaches to understanding gross anatomy, histology, and functional relationships.",
    "meetDays": "Tr"
  },
  {
    "id": 12,
    "title": "Introduction to Economics",
    "code": "ECON 1",
    "department": "Economics",
    "instructor": "Prof. Martha Olney",
    "building": "Zellerbach Hall",
    "room": "Auditorium",
    "lat": 37.8696,
    "lng": -122.2599,
    "walkingMinutes": 4,
    "startTime": "12:00",
    "endTime": "13:00",
    "interests": [
      "Business"
    ],
    "description": "Introduction to economic analysis and its applications to contemporary problems. Supply and demand, market equilibrium, competition and monopoly, externalities and public goods.",
    "meetDays": "F"
  },
  {
    "id": 13,
    "title": "Principles of Macroeconomics",
    "code": "ECON 2",
    "department": "Economics",
    "instructor": "Prof. Barry Eichengreen",
    "building": "Hearst Mining Building",
    "room": "310",
    "lat": 37.8759,
    "lng": -122.2579,
    "walkingMinutes": 7,
    "startTime": "14:00",
    "endTime": "15:00",
    "interests": [
      "Business"
    ],
    "description": "Introduction to macroeconomic analysis: national income and product accounts, business cycles, unemployment, inflation, money and banking, fiscal and monetary policy.",
    "meetDays": "MT"
  },
  {
    "id": 14,
    "title": "Introduction to Art History",
    "code": "HISTART 4A",
    "department": "History of Art",
    "instructor": "Prof. Whitney Davis",
    "building": "Kroeber Hall",
    "room": "160",
    "lat": 37.8731,
    "lng": -122.2641,
    "walkingMinutes": 5,
    "startTime": "11:00",
    "endTime": "12:30",
    "interests": [
      "Arts"
    ],
    "description": "A survey of art and architecture from prehistory to the medieval period. Focus on visual analysis, cultural context, and the social functions of art across civilizations.",
    "meetDays": "TW"
  },
  {
    "id": 15,
    "title": "Modern Art",
    "code": "HISTART 103",
    "department": "History of Art",
    "instructor": "Prof. T.J. Clark",
    "building": "Kroeber Hall",
    "room": "221",
    "lat": 37.8731,
    "lng": -122.2641,
    "walkingMinutes": 5,
    "startTime": "15:00",
    "endTime": "16:30",
    "interests": [
      "Arts"
    ],
    "description": "Art from the French Revolution to the present. Impressionism, Post-Impressionism, Cubism, Abstract Expressionism, and contemporary movements examined in their social contexts.",
    "meetDays": "MWF"
  },
  {
    "id": 16,
    "title": "Introduction to Chemistry",
    "code": "CHEM 1A",
    "department": "Chemistry",
    "instructor": "Prof. Peidong Yang",
    "building": "Pimentel Hall",
    "room": "1",
    "lat": 37.8745,
    "lng": -122.2607,
    "walkingMinutes": 4,
    "startTime": "09:00",
    "endTime": "10:00",
    "interests": [
      "Science"
    ],
    "description": "Atomic and molecular structure, chemical bonding, thermodynamics, kinetics, and equilibrium. Laboratory work develops quantitative skills and introduces experimental chemistry.",
    "meetDays": "MTrW"
  },
  {
    "id": 17,
    "title": "Organic Chemistry",
    "code": "CHEM 3A",
    "department": "Chemistry",
    "instructor": "Prof. Richmond Sarpong",
    "building": "Pimentel Hall",
    "room": "1",
    "lat": 37.8745,
    "lng": -122.2607,
    "walkingMinutes": 4,
    "startTime": "11:00",